	eco	name	fen	moves	pgn
0	A00	Amar Gambit	rn1qkbnr/ppp2ppp/8/3p4/5p2/6PB/PPPPP2P/RNBQK2R w KQkq -	g1h3 d7d5 g2g3 e7e5 f2f4 c8h3 f1h3 e5f4	1. g1 h3 2. d7 d5 3. g2 g3 4. e7 e5 5. f2 f4 6. c8 h3 7. f1 h3 8. e5 f4 
1	A00	Amar Opening: Gent Gambit	rn1qkbnr/ppp2ppp/8/3p4/8/6PB/PPPPP3/RNBQ1RK1 b kq -	g1h3 d7d5 g2g3 e7e5 f2f4 c8h3 f1h3 e5f4 e1g1 f4g3 h2g3	1. g1 h3 2. d7 d5 3. g2 g3 4. e7 e5 5. f2 f4 6. c8 h3 7. f1 h3 8. e5 f4 9. e1 g1 10. f4 g3 11. h2 g3 
2	A00	Amar Opening: Paris Gambit	rnbqkbnr/ppp2ppp/8/3pp3/5P2/6PN/PPPPP2P/RNBQKB1R b KQkq -	g1h3 d7d5 g2g3 e7e5 f2f4	1. g1 h3 2. d7 d5 3. g2 g3 4. e7 e5 5. f2 f4 
3	A00	Amar Opening	rnbqkbnr/pppppppp/8/8/8/7N/PPPPPPPP/RNBQKB1R b KQkq -	g1h3	1. g1 h3 
4	A00	Amsterdam Attack	r1bqkb1r/ppp2ppp/2np1n2/4p3/2P5/1PN1P3/P2P1PPP/R1BQKBNR w KQkq -	e2e3 e7e5 c2c4 d7d6 b1c3 b8c6 b2b3 g8f6	1. e2 e3 2. e7 e5 3. c2 c4 4. d7 d6 5. b1 c3 6. b8 c6 7. b2 b3 8. g8 f6 
5	A00	Anderssen Opening: Polish Gambit	rnbqkbnr/1ppppppp/8/p7/1P6/P7/2PPPPPP/RNBQKBNR b KQkq -	a2a3 a7a5 b2b4	1. a2 a3 2. a7 a5 3. b2 b4 
6	A00	Anderssen Opening	rnbqkbnr/pppppppp/8/8/8/P7/1PPPPPPP/RNBQKBNR b KQkq -	a2a3	1. a2 a3 
7	A00	Barnes Opening: Fool's Mate	rnb1kbnr/pppp1ppp/8/4p3/6Pq/5P2/PPPPP2P/RNBQKBNR w KQkq -	f2f3 e7e5 g2g4 d8h4	1. f2 f3 2. e7 e5 3. g2 g4 4. d8 h4 
8	A00	Barnes Opening: Gedult Gambit	rnbqkbnr/ppp1pp1p/6p1/8/3Pp3/2P2P2/PP4PP/RNBQKBNR b KQkq -	f2f3 d7d5 e2e4 g7g6 d2d4 d5e4 c2c3	1. f2 f3 2. d7 d5 3. e2 e4 4. g7 g6 5. d2 d4 6. d5 e4 7. c2 c3 
9	A00	Barnes Opening: Gedult Gambit	rnbqkbnr/ppppp1pp/8/8/4p3/2N2P2/PPPP2PP/R1BQKBNR b KQkq -	f2f3 f7f5 e2e4 f5e4 b1c3	1. f2 f3 2. f7 f5 3. e2 e4 4. f5 e4 5. b1 c3 
10	A00	Barnes Opening: Hammerschlag	rnbqkbnr/pppp1ppp/8/4p3/8/5P2/PPPPPKPP/RNBQ1BNR b kq -	f2f3 e7e5 e1f2	1. f2 f3 2. e7 e5 3. e1 f2 
11	A00	Caro-Kann Defense: Labahn Attack	rnbqkbnr/pp1ppppp/2p5/8/1P2P3/8/P1PP1PPP/RNBQKBNR b KQkq -	b2b4 c7c6 e2e4	1. b2 b4 2. c7 c6 3. e2 e4 
12	A00	Clemenz Opening	rnbqkbnr/pppppppp/8/8/8/7P/PPPPPPP1/RNBQKBNR b KQkq -	h2h3	1. h2 h3 
13	A00	Clemenz Opening: Spike Lee Gambit	rnbqkbnr/ppppppp1/8/7p/6P1/7P/PPPPPP2/RNBQKBNR b KQkq -	h2h3 h7h5 g2g4	1. h2 h3 2. h7 h5 3. g2 g4 
14	A00	Crab Opening	rnbqkbnr/pppp1ppp/8/4p3/P6P/8/1PPPPPP1/RNBQKBNR b KQkq -	a2a4 e7e5 h2h4	1. a2 a4 2. e7 e5 3. h2 h4 
15	A00	Creepy Crawly Formation: Classical Defense	rnbqkbnr/ppp2ppp/8/3pp3/8/P6P/1PPPPPP1/RNBQKBNR w KQkq -	h2h3 d7d5 a2a3 e7e5	1. h2 h3 2. d7 d5 3. a2 a3 4. e7 e5 
16	A00	Englund Gambit Declined, Reversed French	rnbqkbnr/pppp1ppp/8/4p3/3P4/4P3/PPP2PPP/RNBQKBNR b KQkq -	e2e3 e7e5 d2d4	1. e2 e3 2. e7 e5 3. d2 d4 
17	A00	Formation: Cabbage Attack	r1bq1rk1/ppp2ppp/2nb1n2/3pp3/P7/1PP1P1P1/1B1P1P1P/RN1QKBNR b KQ -	c2c3 e7e5 a2a3 d7d5 b2b3 g8f6 c1b2 b8c6 a3a4 f8d6 g2g3 e8g8 e2e3	1. c2 c3 2. e7 e5 3. a2 a3 4. d7 d5 5. b2 b3 6. g8 f6 7. c1 b2 8. b8 c6 9. a3 a4 10. f8 d6 11. g2 g3 12. e8 g8 13. e2 e3 
18	A00	Formation: Hippopotamus Attack	r1bq1rk1/ppp2ppp/2nb1n2/3pp3/8/PPPPPPP1/7P/RNBQKBNR b KQ -	a2a3 e7e5 b2b3 d7d5 c2c3 g8f6 d2d3 b8c6 e2e3 f8d6 f2f3 e8g8 g2g3	1. a2 a3 2. e7 e5 3. b2 b3 4. d7 d5 5. c2 c3 6. g8 f6 7. d2 d3 8. b8 c6 9. e2 e3 10. f8 d6 11. f2 f3 12. e8 g8 13. g2 g3 
19	A00	Formation: Shy Attack	r1bq1rk1/ppp2ppp/2nb1n2/3pp3/8/P2PP1PP/1PPN1PB1/R1BQK1NR b KQ -	a2a3 e7e5 g2g3 d7d5 f1g2 g8f6 d2d3 b8c6 b1d2 f8d6 e2e3 e8g8 h2h3	1. a2 a3 2. e7 e5 3. g2 g3 4. d7 d5 5. f1 g2 6. g8 f6 7. d2 d3 8. b8 c6 9. b1 d2 10. f8 d6 11. e2 e3 12. e8 g8 13. h2 h3 
20	A00	Gedult's Opening	rnbqkbnr/pppppppp/8/8/8/5P2/PPPPP1PP/RNBQKBNR b KQkq -	f2f3	1. f2 f3 
21	A00	Global Opening	rnbqkbnr/pppp1ppp/8/4p3/8/P6P/1PPPPPP1/RNBQKBNR b KQkq -	h2h3 e7e5 a2a3	1. h2 h3 2. e7 e5 3. a2 a3 
22	A00	Grob Opening: Alessi Gambit	rnbqkbnr/ppppp1pp/8/5p2/6P1/8/PPPPPP1P/RNBQKBNR w KQkq -	g2g4 f7f5	1. g2 g4 2. f7 f5 
23	A00	Grob Opening: Double Grob, Coca-Cola Gambit	rnbqkbnr/pppppp1p/8/6p1/5PP1/8/PPPPP2P/RNBQKBNR b KQkq -	g2g4 g7g5 f2f4	1. g2 g4 2. g7 g5 3. f2 f4 
24	A00	Grob Opening: Double Grob	rnbqkbnr/pppppp1p/8/6p1/6P1/8/PPPPPP1P/RNBQKBNR w KQkq -	g2g4 g7g5	1. g2 g4 2. g7 g5 
25	A00	Grob Opening: Grob Gambit, Basman Gambit	rnbqkbnr/ppp1ppp1/8/3p3P/8/8/PPPPPPBP/RNBQK1NR b KQkq -	g2g4 d7d5 f1g2 h7h5 g4h5	1. g2 g4 2. d7 d5 3. f1 g2 4. h7 h5 5. g4 h5 
26	A00	Grob Opening: Grob Gambit Declined	rnbqkbnr/pp2pppp/2p5/3p4/6P1/8/PPPPPPBP/RNBQK1NR w KQkq -	g2g4 d7d5 f1g2 c7c6	1. g2 g4 2. d7 d5 3. f1 g2 4. c7 c6 
27	A00	Grob Opening: Grob Gambit, Fritz Gambit	rn1qkbnr/ppp1pppp/8/3p4/2P3b1/8/PP1PPPBP/RNBQK1NR b KQkq -	g2g4 d7d5 f1g2 c8g4 c2c4	1. g2 g4 2. d7 d5 3. f1 g2 4. c8 g4 5. c2 c4 
28	A00	Grob Opening: Grob Gambit, Fritz Gambit, Romford Countergambit	q3kbnr/p1pnpppp/8/8/2Pp2b1/8/PP1PPP1P/RNBQK1NR w KQk -	g2g4 d7d5 f1g2 c8g4 c2c4 d5d4 g2b7 b8d7 b7a8 d8a8	1. g2 g4 2. d7 d5 3. f1 g2 4. c8 g4 5. c2 c4 6. d5 d4 7. g2 b7 8. b8 d7 9. b7 a8 10. d8 a8 
29	A00	Grob Opening: Grob Gambit, Keres Gambit	rnbqkbnr/ppp2ppp/8/3p4/3p2P1/2P5/PP2PPBP/RNBQK1NR b KQkq -	g2g4 d7d5 f1g2 e7e5 d2d4 e5d4 c2c3	1. g2 g4 2. d7 d5 3. f1 g2 4. e7 e5 5. d2 d4 6. e5 d4 7. c2 c3 
30	A00	Grob Opening: Grob Gambit, Richter-Grob Gambit	rnbqkbnr/pp2pppp/2p5/8/2p3P1/1P6/P2PPPBP/RNBQK1NR b KQkq -	g2g4 d7d5 f1g2 c7c6 c2c4 d5c4 b2b3	1. g2 g4 2. d7 d5 3. f1 g2 4. c7 c6 5. c2 c4 6. d5 c4 7. b2 b3 
31	A00	Grob Opening: Grob Gambit	rnbqkbnr/ppp1pppp/8/3p4/6P1/8/PPPPPPBP/RNBQK1NR b KQkq -	g2g4 d7d5 f1g2	1. g2 g4 2. d7 d5 3. f1 g2 
32	A00	Grob Opening: Keene Defense, Main Line	rnbqk2r/pp2nppp/2pb4/3p4/2PPp1P1/2N4P/PP2PPB1/R1BQK1NR w KQkq -	g2g4 d7d5 h2h3 e7e5 f1g2 c7c6 d2d4 e5e4 c2c4 f8d6 b1c3 g8e7	1. g2 g4 2. d7 d5 3. h2 h3 4. e7 e5 5. f1 g2 6. c7 c6 7. d2 d4 8. e5 e4 9. c2 c4 10. f8 d6 11. b1 c3 12. g8 e7 
33	A00	Grob Opening: Keene Defense	rnbqkbnr/pp3ppp/2p5/3pp3/6P1/7P/PPPPPPB1/RNBQK1NR w KQkq -	g2g4 d7d5 h2h3 e7e5 f1g2 c7c6	1. g2 g4 2. d7 d5 3. h2 h3 4. e7 e5 5. f1 g2 6. c7 c6 
34	A00	Grob Opening: London Defense	r1bqkbnr/pppp1ppp/2n5/4p3/6P1/7P/PPPPPP2/RNBQKBNR w KQkq -	g2g4 e7e5 h2h3 b8c6	1. g2 g4 2. e7 e5 3. h2 h3 4. b8 c6 
35	A00	Grob Opening	rnbqkbnr/pppppppp/8/8/6P1/8/PPPPPP1P/RNBQKBNR b KQkq -	g2g4	1. g2 g4 
36	A00	Grob Opening: Romford Countergambit	rn1qkbnr/ppp1pppp/8/8/2Pp2b1/8/PP1PPPBP/RNBQK1NR w KQkq -	g2g4 d7d5 f1g2 c8g4 c2c4 d5d4	1. g2 g4 2. d7 d5 3. f1 g2 4. c8 g4 5. c2 c4 6. d5 d4 
37	A00	Grob Opening: Spike Attack	rnbqkbnr/pp2pppp/2p5/3p2P1/8/8/PPPPPPBP/RNBQK1NR b KQkq -	g2g4 d7d5 f1g2 c7c6 g4g5	1. g2 g4 2. d7 d5 3. f1 g2 4. c7 c6 5. g4 g5 
38	A00	Grob Opening: Spike, Hurst Attack	rnbqkbnr/ppp2ppp/8/3pp3/2P3P1/8/PP1PPPBP/RNBQK1NR b KQkq -	g2g4 e7e5 f1g2 d7d5 c2c4	1. g2 g4 2. e7 e5 3. f1 g2 4. d7 d5 5. c2 c4 
39	A00	Grob Opening: Zilbermints Gambit	rnbqkbnr/ppp1pppp/8/8/4p1P1/2N5/PPPP1P1P/R1BQKBNR b KQkq -	g2g4 d7d5 e2e4 d5e4 b1c3	1. g2 g4 2. d7 d5 3. e2 e4 4. d5 e4 5. b1 c3 
40	A00	Grob Opening: Zilbermints Gambit, Schiller Defense	rnbqkbnr/ppp1ppp1/8/7p/4p1P1/2N5/PPPP1P1P/R1BQKBNR w KQkq -	g2g4 d7d5 e2e4 d5e4 b1c3 h7h5	1. g2 g4 2. d7 d5 3. e2 e4 4. d5 e4 5. b1 c3 6. h7 h5 
41	A00	Grob Opening: Zilbermints Gambit, Zilbermints-Hartlaub Gambit	rnbqkbnr/ppp2ppp/8/4p3/4p1P1/2NP4/PPP2P1P/R1BQKBNR b KQkq -	g2g4 d7d5 e2e4 d5e4 b1c3 e7e5 d2d3	1. g2 g4 2. d7 d5 3. e2 e4 4. d5 e4 5. b1 c3 6. e7 e5 7. d2 d3 
42	A00	Hungarian Opening: Asten Gambit	r1bqkbnr/ppp3pp/2n5/4Pp2/3pN3/6P1/PPP1PP1P/R1BQKBNR w KQkq f6	g2g3 b8c6 b1c3 d7d5 d2d4 e7e5 d4e5 d5d4 c3e4 f7f5	1. g2 g3 2. b8 c6 3. b1 c3 4. d7 d5 5. d2 d4 6. e7 e5 7. d4 e5 8. d5 d4 9. c3 e4 10. f7 f5 
43	A00	Hungarian Opening: Bücker Gambit	rnbqkbnr/ppp2ppp/8/3pp3/1P6/6P1/P1PPPPBP/RNBQK1NR b KQkq -	g2g3 d7d5 f1g2 e7e5 b2b4	1. g2 g3 2. d7 d5 3. f1 g2 4. e7 e5 5. b2 b4 
44	A00	Hungarian Opening: Burk Gambit	rnbqk1nr/ppp1bppp/8/3p4/4p2N/P2P2P1/1PP1PP1P/RNBQKB1R b KQkq -	g2g3 e7e5 a2a3 d7d5 g1f3 e5e4 f3h4 f8e7 d2d3	1. g2 g3 2. e7 e5 3. a2 a3 4. d7 d5 5. g1 f3 6. e5 e4 7. f3 h4 8. f8 e7 9. d2 d3 
45	A00	Hungarian Opening: Catalan Formation	rnbqkbnr/ppp2ppp/4p3/3p4/8/6P1/PPPPPPBP/RNBQK1NR w KQkq -	g2g3 d7d5 f1g2 e7e6	1. g2 g3 2. d7 d5 3. f1 g2 4. e7 e6 
46	A00	Hungarian Opening: Dutch Defense	rnbqkbnr/ppppp1pp/8/5p2/8/6P1/PPPPPP1P/RNBQKBNR w KQkq -	g2g3 f7f5	1. g2 g3 2. f7 f5 
47	A00	Hungarian Opening: Indian Defense	rnbqkb1r/pppppppp/5n2/8/8/6P1/PPPPPP1P/RNBQKBNR w KQkq -	g2g3 g8f6	1. g2 g3 2. g8 f6 
48	A00	Hungarian Opening: Myers Defense	rnbqkbnr/pppppp1p/8/6p1/8/6P1/PPPPPP1P/RNBQKBNR w KQkq -	g2g3 g7g5	1. g2 g3 2. g7 g5 
49	A00	Hungarian Opening: Pachman Gambit	rnbqkbnr/ppppp2p/6p1/7Q/4p3/6P1/PPPP1P1P/RNB1KBNR w KQkq -	g2g3 f7f5 e2e4 f5e4 d1h5 g7g6	1. g2 g3 2. f7 f5 3. e2 e4 4. f5 e4 5. d1 h5 6. g7 g6 
50	A00	Hungarian Opening: Paris Gambit	rn1qkbnr/ppp2ppp/8/3p4/5p2/6PB/PPPPP2P/RNBQ1RK1 b kq -	g2g3 e7e5 g1h3 d7d5 f2f4 c8h3 f1h3 e5f4 e1g1	1. g2 g3 2. e7 e5 3. g1 h3 4. d7 d5 5. f2 f4 6. c8 h3 7. f1 h3 8. e5 f4 9. e1 g1 
51	A00	Hungarian Opening: Reversed Alekhine	rnbqkbnr/pppp1ppp/8/4p3/8/5NP1/PPPPPP1P/RNBQKB1R b KQkq -	g2g3 e7e5 g1f3	1. g2 g3 2. e7 e5 3. g1 f3 
52	A00	Hungarian Opening: Reversed Brooklyn Defense, Brooklyn Benko Gambit	rnbqkb1r/pppp1ppp/5n2/8/1P2p3/6P1/P1PPPP1P/RNBQKBNR b KQkq -	g2g3 e7e5 g1f3 e5e4 f3g1 g8f6 b2b4	1. g2 g3 2. e7 e5 3. g1 f3 4. e5 e4 5. f3 g1 6. g8 f6 7. b2 b4 
53	A00	Hungarian Opening: Reversed Modern Defense	rnbqkbnr/pp2pppp/8/2pp4/8/6P1/PPPPPPBP/RNBQK1NR w KQkq -	g2g3 d7d5 f1g2 c7c5	1. g2 g3 2. d7 d5 3. f1 g2 4. c7 c5 
54	A00	Hungarian Opening: Reversed Norwegian Defense	rnbqkbnr/pppp1ppp/8/8/4p2N/6P1/PPPPPP1P/RNBQKB1R b KQkq -	g2g3 e7e5 g1f3 e5e4 f3h4	1. g2 g3 2. e7 e5 3. g1 f3 4. e5 e4 5. f3 h4 
55	A00	Hungarian Opening	rnbqkbnr/pppppppp/8/8/8/6P1/PPPPPP1P/RNBQKBNR b KQkq -	g2g3	1. g2 g3 
56	A00	Hungarian Opening: Sicilian Invitation	rnbqkbnr/pp1ppppp/8/2p5/8/6P1/PPPPPP1P/RNBQKBNR w KQkq -	g2g3 c7c5	1. g2 g3 2. c7 c5 
57	A00	Hungarian Opening: Slav Formation	rnbqkbnr/pp2pppp/2p5/3p4/8/6P1/PPPPPPBP/RNBQK1NR w KQkq -	g2g3 d7d5 f1g2 c7c6	1. g2 g3 2. d7 d5 3. f1 g2 4. c7 c6 
58	A00	Hungarian Opening: Symmetrical Variation	rnbqkbnr/pppppp1p/6p1/8/8/6P1/PPPPPP1P/RNBQKBNR w KQkq -	g2g3 g7g6	1. g2 g3 2. g7 g6 
59	A00	Hungarian Opening: Van Kuijk Gambit	rnbqkbnr/ppppppp1/8/8/7p/5NP1/PPPPPP1P/RNBQKB1R w KQkq -	g2g3 h7h5 g1f3 h5h4	1. g2 g3 2. h7 h5 3. g1 f3 4. h5 h4 
60	A00	Hungarian Opening: Winterberg Gambit	rnbqkbnr/ppp2ppp/8/4p3/2p5/1P4P1/P2PPPBP/RNBQK1NR b KQkq -	g2g3 d7d5 f1g2 e7e5 c2c4 d5c4 b2b3	1. g2 g3 2. d7 d5 3. f1 g2 4. e7 e5 5. c2 c4 6. d5 c4 7. b2 b3 
61	A00	Indian Game: Colle System, King's Indian Variation	rnbqk2r/ppp1ppbp/3p1np1/8/3P4/3BPN2/PPP2PPP/RNBQK2R w KQkq -	e2e3 d7d6 d2d4 g7g6 g1f3 f8g7 f1d3 g8f6	1. e2 e3 2. d7 d6 3. d2 d4 4. g7 g6 5. g1 f3 6. f8 g7 7. f1 d3 8. g8 f6 
62	A00	Kadas Opening: Beginner's Trap	rnbqkbnr/ppp1pppp/8/3p4/7P/7R/PPPPPPP1/RNBQKBN1 b Qkq -	h2h4 d7d5 h1h3	1. h2 h4 2. d7 d5 3. h1 h3 
63	A00	Kadas Opening: Kadas Gambit	rnbqkbnr/pp1ppppp/8/2p5/1P5P/8/P1PPPPP1/RNBQKBNR b KQkq -	h2h4 c7c5 b2b4	1. h2 h4 2. c7 c5 3. b2 b4 
64	A00	Kadas Opening: Kadas Gambit	rnbqkbnr/pp2pppp/8/3p4/3p3P/2P2N2/PP2PPP1/RNBQKB1R b KQkq -	h2h4 d7d5 d2d4 c7c5 g1f3 c5d4 c2c3	1. h2 h4 2. d7 d5 3. d2 d4 4. c7 c5 5. g1 f3 6. c5 d4 7. c2 c3 
65	A00	Kadas Opening: Kadas Gambit	rnbqkbnr/pppp1ppp/8/8/3p3P/2P5/PP2PPP1/RNBQKBNR b KQkq -	h2h4 e7e5 d2d4 e5d4 c2c3	1. h2 h4 2. e7 e5 3. d2 d4 4. e5 d4 5. c2 c3 
66	A00	Kadas Opening: Myers Variation	rnbqkbnr/pp2pppp/8/2pp4/3PP2P/8/PPP2PP1/RNBQKBNR b KQkq -	h2h4 d7d5 d2d4 c7c5 e2e4	1. h2 h4 2. d7 d5 3. d2 d4 4. c7 c5 5. e2 e4 
67	A00	Kadas Opening	rnbqkbnr/pppppppp/8/8/7P/8/PPPPPPP1/RNBQKBNR b KQkq -	h2h4	1. h2 h4 
68	A00	Kadas Opening: Schneider Gambit	rnbqkbnr/pppppp1p/8/6p1/7P/8/PPPPPPP1/RNBQKBNR w KQkq -	h2h4 g7g5	1. h2 h4 2. g7 g5 
69	A00	Kadas Opening: Steinbok Gambit	rnbqkbnr/ppppp1pp/8/8/4p2P/3P4/PPP2PP1/RNBQKBNR b KQkq -	h2h4 f7f5 e2e4 f5e4 d2d3	1. h2 h4 2. f7 f5 3. e2 e4 4. f5 e4 5. d2 d3 
70	A00	Lasker Simul Special	rnbqkbnr/ppppppp1/8/7p/8/6P1/PPPPPP1P/RNBQKBNR w KQkq -	g2g3 h7h5	1. g2 g3 2. h7 h5 
71	A00	Mieses Opening: Myers Spike Attack	rnbqkbnr/pppppp1p/6p1/8/6P1/3P4/PPP1PP1P/RNBQKBNR b KQkq -	d2d3 g7g6 g2g4	1. d2 d3 2. g7 g6 3. g2 g4 
72	A00	Mieses Opening: Reversed Rat	rnbqkbnr/pppp1ppp/8/4p3/8/3P4/PPP1PPPP/RNBQKBNR w KQkq -	d2d3 e7e5	1. d2 d3 2. e7 e5 
73	A00	Mieses Opening	rnbqkbnr/pppppppp/8/8/8/3P4/PPP1PPPP/RNBQKBNR b KQkq -	d2d3	1. d2 d3 
74	A00	Polish Opening: Baltic Defense	rn1qkbnr/ppp1pppp/8/3p1b2/1P6/8/PBPPPPPP/RN1QKBNR w KQkq -	b2b4 d7d5 c1b2 c8f5	1. b2 b4 2. d7 d5 3. c1 b2 4. c8 f5 
75	A00	Polish Opening: Birmingham Gambit	rnbqkbnr/pp1ppppp/8/2p5/1P6/8/P1PPPPPP/RNBQKBNR w KQkq -	b2b4 c7c5	1. b2 b4 2. c7 c5 
76	A00	Polish Opening: Bugayev Advance Variation	rnbqkbnr/pppp2pp/5p2/1P2p3/8/8/PBPPPPPP/RN1QKBNR b KQkq -	b2b4 e7e5 c1b2 f7f6 b4b5	1. b2 b4 2. e7 e5 3. c1 b2 4. f7 f6 5. b4 b5 
77	A00	Polish Opening: Bugayev Attack	rnbqkbnr/pppp1ppp/8/4p3/1P6/P7/2PPPPPP/RNBQKBNR b KQkq -	b2b4 e7e5 a2a3	1. b2 b4 2. e7 e5 3. a2 a3 
78	A00	Polish Opening: Czech Defense	rnbqkbnr/ppp2ppp/3p4/4p3/1P6/8/PBPPPPPP/RN1QKBNR w KQkq -	b2b4 e7e5 c1b2 d7d6	1. b2 b4 2. e7 e5 3. c1 b2 4. d7 d6 
79	A00	Polish Opening: Dutch Defense	rnbqkbnr/ppppp1pp/8/5p2/1P6/8/P1PPPPPP/RNBQKBNR w KQkq -	b2b4 f7f5	1. b2 b4 2. f7 f5 
80	A00	Polish Opening: German Defense	rnb1kbnr/ppp1pppp/3q4/3p4/1P6/8/PBPPPPPP/RN1QKBNR w KQkq -	b2b4 d7d5 c1b2 d8d6	1. b2 b4 2. d7 d5 3. c1 b2 4. d8 d6 
81	A00	Polish Opening: Grigorian Variation	r1bqkbnr/pppppppp/2n5/8/1P6/8/P1PPPPPP/RNBQKBNR w KQkq -	b2b4 b8c6	1. b2 b4 2. b8 c6 
82	A00	Polish Opening: Karniewski Variation	rnbqkb1r/pppppppp/7n/8/1P6/8/P1PPPPPP/RNBQKBNR w KQkq -	b2b4 g8h6	1. b2 b4 2. g8 h6 
83	A00	Polish Opening: King's Indian Variation	rnbqkb1r/pppppp1p/5np1/8/1P6/8/PBPPPPPP/RN1QKBNR w KQkq -	b2b4 g8f6 c1b2 g7g6	1. b2 b4 2. g8 f6 3. c1 b2 4. g7 g6 
84	A00	Polish Opening: King's Indian Variation, Schiffler Attack	rnbqkb1r/pppppp1p/5np1/8/1P2P3/8/PBPP1PPP/RN1QKBNR b KQkq -	b2b4 g8f6 c1b2 g7g6 e2e4	1. b2 b4 2. g8 f6 3. c1 b2 4. g7 g6 5. e2 e4 
85	A00	Polish Opening: Myers Variation	rnbqkbnr/pp2pppp/2p5/3p4/PP6/8/1BPPPPPP/RN1QKBNR b KQkq -	b2b4 d7d5 c1b2 c7c6 a2a4	1. b2 b4 2. d7 d5 3. c1 b2 4. c7 c6 5. a2 a4 
86	A00	Polish Opening: Orangutan-Diemer Gambit	rnb1kbnr/ppp2ppp/3q4/4p3/1P2p3/P4P2/1BPP2PP/RN1QKBNR b KQkq -	b2b4 d7d5 c1b2 d8d6 a2a3 e7e5 e2e4 d5e4 f2f3	1. b2 b4 2. d7 d5 3. c1 b2 4. d8 d6 5. a2 a3 6. e7 e5 7. e2 e4 8. d5 e4 9. f2 f3 
87	A00	Polish Opening: Orangutan-Hartlaub Gambit	rnbqkb1r/1p3ppp/2p1pn2/P2p4/4P3/P2P4/1BP2PPP/RN1QKBNR b KQkq -	b2b4 g8f6 c1b2 e7e6 a2a3 c7c6 d2d3 a7a5 b4a5 d7d5 e2e4	1. b2 b4 2. g8 f6 3. c1 b2 4. e7 e6 5. a2 a3 6. c7 c6 7. d2 d3 8. a7 a5 9. b4 a5 10. d7 d5 11. e2 e4 
88	A00	Polish Opening: Outflank Variation	rnbqkbnr/pp1ppppp/2p5/8/1P6/8/P1PPPPPP/RNBQKBNR w KQkq -	b2b4 c7c6	1. b2 b4 2. c7 c6 
89	A00	Polish Opening: Queenside Defense	rnbqkb1r/1ppp1ppp/p3pn2/1P6/8/8/PBPPPPPP/RN1QKBNR w KQkq -	b2b4 e7e6 c1b2 g8f6 b4b5 a7a6	1. b2 b4 2. e7 e6 3. c1 b2 4. g8 f6 5. b4 b5 6. a7 a6 
90	A00	Polish Opening: Queen's Indian Variation	rnbqkb1r/p1pp1ppp/1p2pn2/1P6/8/8/PBPPPPPP/RN1QKBNR w KQkq -	b2b4 e7e6 c1b2 g8f6 b4b5 b7b6	1. b2 b4 2. e7 e6 3. c1 b2 4. g8 f6 5. b4 b5 6. b7 b6 
91	A00	Polish Opening	rnbqkbnr/pppppppp/8/8/1P6/8/P1PPPPPP/RNBQKBNR b KQkq -	b2b4	1. b2 b4 
92	A00	Polish Opening: Rooks Swap Line	1nbqkb1r/1ppp1ppp/4pn2/1P6/8/8/2PPPPPP/BN1QKBNR b Kk -	b2b4 e7e6 c1b2 g8f6 b4b5 a7a6 a2a4 a6b5 a4b5 a8a1 b2a1	1. b2 b4 2. e7 e6 3. c1 b2 4. g8 f6 5. b4 b5 6. a7 a6 7. a2 a4 8. a6 b5 9. a4 b5 10. a8 a1 11. b2 a1 
93	A00	Polish Opening: Schiffler-Sokolsky Variation	rnbqkb1r/ppp2ppp/4pn2/1P1p4/8/4P3/PBPP1PPP/RN1QKBNR b KQkq -	b2b4 e7e6 c1b2 g8f6 b4b5 d7d5 e2e3	1. b2 b4 2. e7 e6 3. c1 b2 4. g8 f6 5. b4 b5 6. d7 d5 7. e2 e3 
94	A00	Polish Opening: Schuehler Gambit	rnbqkbnr/1p1ppppp/8/pp6/4P3/8/PBPP1PPP/RN1QKBNR b KQkq -	b2b4 c7c6 c1b2 a7a5 b4b5 c6b5 e2e4	1. b2 b4 2. c7 c6 3. c1 b2 4. a7 a5 5. b4 b5 6. c6 b5 7. e2 e4 
95	A00	Polish Opening: Symmetrical Variation	rnbqkbnr/p1pppppp/8/1p6/1P6/8/P1PPPPPP/RNBQKBNR w KQkq -	b2b4 b7b5	1. b2 b4 2. b7 b5 
96	A00	Polish Opening: Tartakower Gambit, Brinckmann Variation	r1b1k1nr/ppppq2p/2n2pp1/4pP2/1bB1P3/8/PBPP2PP/RN1QK1NR w KQkq -	b2b4 e7e5 c1b2 f7f6 e2e4 f8b4 f1c4 b8c6 f2f4 d8e7 f4f5 g7g6	1. b2 b4 2. e7 e5 3. c1 b2 4. f7 f6 5. e2 e4 6. f8 b4 7. f1 c4 8. b8 c6 9. f2 f4 10. d8 e7 11. f4 f5 12. g7 g6 
97	A00	Polish Opening: Tartakower Gambit	rnbqkbnr/pppp2pp/5p2/4p3/1P2P3/8/PBPP1PPP/RN1QKBNR b KQkq -	b2b4 e7e5 c1b2 f7f6 e2e4	1. b2 b4 2. e7 e5 3. c1 b2 4. f7 f6 5. e2 e4 
98	A00	Polish Opening: Wolferts Gambit	rnbqkbnr/pp1p1ppp/8/2p1p3/1P6/8/PBPPPPPP/RN1QKBNR w KQkq -	b2b4 e7e5 c1b2 c7c5	1. b2 b4 2. e7 e5 3. c1 b2 4. c7 c5 
99	A00	Saragossa Opening	rnbqkbnr/pppppppp/8/8/8/2P5/PP1PPPPP/RNBQKBNR b KQkq -	c2c3	1. c2 c3 
100	A00	Sodium Attack: Celadon Variation	rnbqk1nr/pp3ppp/8/2ppp3/8/P2PP3/P1P2PPP/1RBQKBNR b Kkq -	b1a3 e7e5 d2d3 f8a3 b2a3 d7d5 e2e3 c7c5 a1b1	1. b1 a3 2. e7 e5 3. d2 d3 4. f8 a3 5. b2 a3 6. d7 d5 7. e2 e3 8. c7 c5 9. a1 b1 
101	A00	Sodium Attack: Chenoboskion Variation	rnbqkbnr/pppppp1p/6p1/8/6P1/N7/PPPPPP1P/R1BQKBNR b KQkq -	b1a3 g7g6 g2g4	1. b1 a3 2. g7 g6 3. g2 g4 
102	A00	Sodium Attack: Durkin Gambit	r1bqkbnr/pppp2pp/2n5/4pp2/2N1P3/8/PPPP1PPP/R1BQKBNR w KQkq -	b1a3 e7e5 a3c4 b8c6 e2e4 f7f5	1. b1 a3 2. e7 e5 3. a3 c4 4. b8 c6 5. e2 e4 6. f7 f5 
103	A00	Sodium Attack	rnbqkbnr/pppppppp/8/8/8/N7/PPPPPPPP/R1BQKBNR b KQkq -	b1a3	1. b1 a3 
104	A00	Valencia Opening	rnbqkbnr/pppp1ppp/8/4p3/8/3P4/PPPNPPPP/R1BQKBNR b KQkq -	d2d3 e7e5 b1d2	1. d2 d3 2. e7 e5 3. b1 d2 
105	A00	Van Geet Opening: Battambang Variation	rnbqkbnr/pppp1ppp/8/4p3/8/P1N5/1PPPPPPP/R1BQKBNR b KQkq -	a2a3 e7e5 b1c3	1. a2 a3 2. e7 e5 3. b1 c3 
106	A00	Van Geet Opening: Billockus-Johansen Gambit	rnbqk1nr/pppp1ppp/8/2b1p3/8/2N2N2/PPPPPPPP/R1BQKB1R w KQkq -	b1c3 e7e5 g1f3 f8c5	1. b1 c3 2. e7 e5 3. g1 f3 4. f8 c5 
107	A00	Van Geet Opening: Caro-Kann Variation, St. Patrick's Attack	rnbqkbnr/pp2pppp/2p5/3p4/4P3/2N4P/PPPP1PP1/R1BQKBNR b KQkq -	b1c3 d7d5 e2e4 c7c6 h2h3	1. b1 c3 2. d7 d5 3. e2 e4 4. c7 c6 5. h2 h3 
108	A00	Van Geet Opening: Damhaug Gambit	rnbqkbnr/ppp2ppp/8/3pp3/5P2/2N5/PPPPP1PP/R1BQKBNR w KQkq -	b1c3 d7d5 f2f4 e7e5	1. b1 c3 2. d7 d5 3. f2 f4 4. e7 e5 
109	A00	Van Geet Opening: Dougherty Gambit	rnbqkbnr/ppp1pppp/8/8/4p3/2N2P2/PPPP2PP/R1BQKBNR b KQkq -	b1c3 d7d5 e2e4 d5e4 f2f3	1. b1 c3 2. d7 d5 3. e2 e4 4. d5 e4 5. f2 f3 
110	A00	Van Geet Opening: Dunst-Perrenet Gambit	rnbqkbnr/ppp1pppp/8/8/4p3/2NP4/PPP2PPP/R1BQKBNR b KQkq -	b1c3 d7d5 e2e4 d5e4 d2d3	1. b1 c3 2. d7 d5 3. e2 e4 4. d5 e4 5. d2 d3 
111	A00	Van Geet Opening: Düsseldorf Gambit	rnbqkbnr/pp1ppppp/8/2p5/1P6/2N5/P1PPPPPP/R1BQKBNR b KQkq -	b1c3 c7c5 b2b4	1. b1 c3 2. c7 c5 3. b2 b4 
112	A00	Van Geet Opening: Gladbacher Gambit	rnbqkbnr/ppp2ppp/8/4p3/4p3/1PNP4/P1P2PPP/R1BQKBNR b KQkq -	b1c3 e7e5 b2b3 d7d5 e2e4 d5e4 d2d3	1. b1 c3 2. e7 e5 3. b2 b3 4. d7 d5 5. e2 e4 6. d5 e4 7. d2 d3 
113	A00	Van Geet Opening: Hector Gambit	rnbqkbnr/ppp1pppp/8/8/2B1p3/2N5/PPPP1PPP/R1BQK1NR b KQkq -	b1c3 d7d5 e2e4 d5e4 f1c4	1. b1 c3 2. d7 d5 3. e2 e4 4. d5 e4 5. f1 c4 
114	A00	Van Geet Opening: Hergert Gambit	r1bqkbnr/ppp2ppp/2np4/4P3/8/2N5/PPPPP1PP/R1BQKBNR w KQkq -	b1c3 d7d6 f2f4 e7e5 f4e5 b8c6	1. b1 c3 2. d7 d6 3. f2 f4 4. e7 e5 5. f4 e5 6. b8 c6 
115	A00	Van Geet Opening: Hulsemann Gambit	rn1qkbnr/ppp2ppp/4b3/3pp2Q/8/2N1P3/PPPP1PPP/R1B1KBNR w KQkq -	b1c3 e7e5 e2e3 d7d5 d1h5 c8e6	1. b1 c3 2. e7 e5 3. e2 e3 4. d7 d5 5. d1 h5 6. c8 e6 
116	A00	Van Geet Opening: Jendrossek Gambit	rnbqkb1r/pp2p1pp/5n2/2p2p2/1P1p1P2/5N2/P1PPPNPP/R1BQKB1R b KQkq -	b1c3 d7d5 f2f4 d5d4 c3e4 f7f5 e4f2 g8f6 g1f3 c7c5 b2b4	1. b1 c3 2. d7 d5 3. f2 f4 4. d5 d4 5. c3 e4 6. f7 f5 7. e4 f2 8. g8 f6 9. g1 f3 10. c7 c5 11. b2 b4 
117	A00	Van Geet Opening: Kluever Gambit	rnbqkbnr/ppppp1pp/8/8/4p3/2NP4/PPP2PPP/R1BQKBNR b KQkq -	b1c3 f7f5 e2e4 f5e4 d2d3	1. b1 c3 2. f7 f5 3. e2 e4 4. f5 e4 5. d2 d3 
118	A00	Van Geet Opening: Laroche Gambit	rnbqkbnr/p1pppppp/8/1p6/8/2N5/PPPPPPPP/R1BQKBNR w KQkq -	b1c3 b7b5	1. b1 c3 2. b7 b5 
119	A00	Van Geet Opening: Liebig Gambit	rnbqkb1r/ppp2ppp/5n2/3pp2Q/8/2N1P3/PPPP1PPP/R1B1KBNR w KQkq -	b1c3 e7e5 e2e3 d7d5 d1h5 g8f6	1. b1 c3 2. e7 e5 3. e2 e3 4. d7 d5 5. d1 h5 6. g8 f6 
120	A00	Van Geet Opening: Melleby Gambit	rnbqkbnr/pp2pppp/8/2p5/3pNP2/8/PPPPP1PP/R1BQKBNR w KQkq -	b1c3 d7d5 f2f4 d5d4 c3e4 c7c5	1. b1 c3 2. d7 d5 3. f2 f4 4. d5 d4 5. c3 e4 6. c7 c5 
121	A00	Van Geet Opening: Myers Attack	rnbqkbnr/pppppp1p/6p1/8/7P/2N5/PPPPPPP1/R1BQKBNR b KQkq -	b1c3 g7g6 h2h4	1. b1 c3 2. g7 g6 3. h2 h4 
122	A00	Van Geet Opening: Napoleon Attack	r1bqkbnr/pppp1ppp/2n5/4p3/3P4/2N2N2/PPP1PPPP/R1BQKB1R b KQkq -	b1c3 e7e5 g1f3 b8c6 d2d4	1. b1 c3 2. e7 e5 3. g1 f3 4. b8 c6 5. d2 d4 
123	A00	Van Geet Opening: Novosibirsk Variation	r1bqkbnr/pp1ppppp/2n5/8/7Q/2N5/PPP1PPPP/R1B1KBNR b KQkq -	b1c3 c7c5 d2d4 c5d4 d1d4 b8c6 d4h4	1. b1 c3 2. c7 c5 3. d2 d4 4. c5 d4 5. d1 d4 6. b8 c6 7. d4 h4 
124	A00	Van Geet Opening: Pfeiffer Gambit	rnbqkbnr/ppp2ppp/8/4p3/3pNP2/8/PPPPP1PP/R1BQKBNR w KQkq -	b1c3 d7d5 f2f4 d5d4 c3e4 e7e5	1. b1 c3 2. d7 d5 3. f2 f4 4. d5 d4 5. c3 e4 6. e7 e5 
125	A00	Van Geet Opening: Pfeiffer Gambit, Sleipnir Countergambit	rnbqkbnr/ppp2ppp/8/4p3/3pNP2/5N2/PPPPP1PP/R1BQKB1R b KQkq -	b1c3 d7d5 f2f4 d5d4 c3e4 e7e5 g1f3	1. b1 c3 2. d7 d5 3. f2 f4 4. d5 d4 5. c3 e4 6. e7 e5 7. g1 f3 
126	A00	Van Geet Opening: Reversed Nimzowitsch	rnbqkbnr/pppp1ppp/8/4p3/8/2N5/PPPPPPPP/R1BQKBNR w KQkq -	b1c3 e7e5	1. b1 c3 2. e7 e5 
127	A00	Van Geet Opening: Reversed Scandinavian	r1bqkbnr/pppp1ppp/2n5/8/Q7/2N5/PPP1PPPP/R1B1KBNR b KQkq -	b1c3 e7e5 d2d4 e5d4 d1d4 b8c6 d4a4	1. b1 c3 2. e7 e5 3. d2 d4 4. e5 d4 5. d1 d4 6. b8 c6 7. d4 a4 
128	A00	Van Geet Opening	rnbqkbnr/pppppppp/8/8/8/2N5/PPPPPPPP/R1BQKBNR b KQkq -	b1c3	1. b1 c3 
129	A00	Van Geet Opening: Sicilian Two Knights	r1bqkbnr/pp1ppppp/2n5/8/3N4/2N5/PPP1PPPP/R1BQKB1R b KQkq -	b1c3 c7c5 g1f3 b8c6 d2d4 c5d4 f3d4	1. b1 c3 2. c7 c5 3. g1 f3 4. b8 c6 5. d2 d4 6. c5 d4 7. f3 d4 
130	A00	Van Geet Opening: Sleipnir Gambit	rnbqk1nr/ppp2ppp/8/3pp3/1b1P4/2N1P3/PPP2PPP/R1BQKBNR w KQkq -	b1c3 d7d5 e2e3 e7e5 d2d4 f8b4	1. b1 c3 2. d7 d5 3. e2 e3 4. e7 e5 5. d2 d4 6. f8 b4 
131	A00	Van Geet Opening: Tübingen Gambit	rnbqkb1r/pppppppp/5n2/8/6P1/2N5/PPPPPP1P/R1BQKBNR b KQkq -	b1c3 g8f6 g2g4	1. b1 c3 2. g8 f6 3. g2 g4 
132	A00	Van Geet Opening: Twyble Attack	rnbqkbnr/pp1ppppp/8/2p5/8/2N5/PPPPPPPP/1RBQKBNR b Kkq -	b1c3 c7c5 a1b1	1. b1 c3 2. c7 c5 3. a1 b1 
133	A00	Van Geet Opening: Venezolana Variation	rnbqkb1r/ppp1pppp/5n2/3p4/8/2NP2P1/PPP1PP1P/R1BQKBNR b KQkq -	b1c3 d7d5 d2d3 g8f6 g2g3	1. b1 c3 2. d7 d5 3. d2 d3 4. g8 f6 5. g2 g3 
134	A00	Van Geet Opening: Warsteiner Gambit	rnbqkbnr/ppp1pp1p/8/3p2p1/5P2/2N5/PPPPP1PP/R1BQKBNR w KQkq -	b1c3 d7d5 f2f4 g7g5	1. b1 c3 2. d7 d5 3. f2 f4 4. g7 g5 
135	A00	Van't Kruijs Opening: Bouncing Bishop Variation	rnbqkbnr/p1pp1ppp/8/1p2p3/8/1B2P3/PPPP1PPP/RNBQK1NR b KQkq -	e2e3 e7e5 f1c4 b7b5 c4b3	1. e2 e3 2. e7 e5 3. f1 c4 4. b7 b5 5. c4 b3 
136	A00	Van't Kruijs Opening: Keoni-Hiva Gambit, Akahi Variation	rnbqkb1r/pppp1ppp/5n2/8/5p2/2N1PN2/PPPP2PP/R1BQKB1R b KQkq -	e2e3 e7e5 b1c3 g8f6 f2f4 e5f4 g1f3	1. e2 e3 2. e7 e5 3. b1 c3 4. g8 f6 5. f2 f4 6. e5 f4 7. g1 f3 
137	A00	Van't Kruijs Opening: Keoni-Hiva Gambit, Alua Variation	r1bqkbnr/pppp1ppp/2n5/8/5p2/2N1PN2/PPPP2PP/R1BQKB1R b KQkq -	e2e3 e7e5 b1c3 b8c6 f2f4 e5f4 g1f3	1. e2 e3 2. e7 e5 3. b1 c3 4. b8 c6 5. f2 f4 6. e5 f4 7. g1 f3 
138	A00	Van't Kruijs Opening: Keoni-Hiva Gambit Delayed	rnbqkb1r/ppp2ppp/5n2/3p4/5p2/P1N1PN2/1PPP2PP/R1BQKB1R b KQkq -	e2e3 d7d5 b1c3 g8f6 a2a3 e7e5 f2f4 e5f4 g1f3	1. e2 e3 2. d7 d5 3. b1 c3 4. g8 f6 5. a2 a3 6. e7 e5 7. f2 f4 8. e5 f4 9. g1 f3 
139	A00	Van't Kruijs Opening: Keoni-Hiva Gambit, Ekolu Variation	rnbqkbnr/ppp2ppp/8/3p4/5p2/2N1PN2/PPPP2PP/R1BQKB1R b KQkq -	e2e3 e7e5 b1c3 d7d5 f2f4 e5f4 g1f3	1. e2 e3 2. e7 e5 3. b1 c3 4. d7 d5 5. f2 f4 6. e5 f4 7. g1 f3 
140	A00	Van't Kruijs Opening	rnbqkbnr/pppppppp/8/8/8/4P3/PPPP1PPP/RNBQKBNR b KQkq -	e2e3	1. e2 e3 
141	A00	Venezolana Opening	r1bqkbnr/pp1ppppp/2n5/2p5/8/2NP2P1/PPP1PP1P/R1BQKBNR b KQkq -	d2d3 c7c5 b1c3 b8c6 g2g3	1. d2 d3 2. c7 c5 3. b1 c3 4. b8 c6 5. g2 g3 
142	A00	Ware Opening: Cologne Gambit	r1bqkbnr/p1pnpppp/1p6/3p4/P2P4/2N5/1PP1PPPP/R1BQKBNR w KQkq -	a2a4 b7b6 d2d4 d7d5 b1c3 b8d7	1. a2 a4 2. b7 b6 3. d2 d4 4. d7 d5 5. b1 c3 6. b8 d7 
143	A00	Ware Opening: Meadow Hay Trap	rnbqkbnr/pppp1ppp/8/4p3/P7/R7/1PPPPPPP/1NBQKBNR b Kkq -	a2a4 e7e5 a1a3	1. a2 a4 2. e7 e5 3. a1 a3 
144	A00	Ware Opening	rnbqkbnr/pppppppp/8/8/P7/8/1PPPPPPP/RNBQKBNR b KQkq -	a2a4	1. a2 a4 
145	A00	Ware Opening: Ware Gambit	rnbqkbnr/ppp3pp/P7/3ppp2/8/4P3/1PPP1PPP/RNBQKBNR b KQkq -	a2a4 e7e5 a4a5 d7d5 e2e3 f7f5 a5a6	1. a2 a4 2. e7 e5 3. a4 a5 4. d7 d5 5. e2 e3 6. f7 f5 7. a5 a6 
146	A00	Ware Opening: Wing Gambit	rn1qkbnr/pbpppppp/8/1P6/8/8/1PPPPPPP/RNBQKBNR w KQkq -	a2a4 b7b5 a4b5 c8b7	1. a2 a4 2. b7 b5 3. a4 b5 4. c8 b7 
147	A00	Zukertort Opening: Reversed Mexican Defense	rnbqkbnr/ppp1pppp/8/3p4/8/2N2N2/PPPPPPPP/R1BQKB1R b KQkq -	b1c3 d7d5 g1f3	1. b1 c3 2. d7 d5 3. g1 f3 
148	A01	Nimzo-Larsen Attack: Classical Variation	rnbqkbnr/ppp1pppp/8/3p4/8/1P6/P1PPPPPP/RNBQKBNR w KQkq -	b2b3 d7d5	1. b2 b3 2. d7 d5 
149	A01	Nimzo-Larsen Attack: Dutch Variation	rnbqkbnr/ppppp1pp/8/5p2/8/1P6/P1PPPPPP/RNBQKBNR w KQkq -	b2b3 f7f5	1. b2 b3 2. f7 f5 
150	A01	Nimzo-Larsen Attack: English Variation	rnbqkbnr/pp1ppppp/8/2p5/8/1P6/P1PPPPPP/RNBQKBNR w KQkq -	b2b3 c7c5	1. b2 b3 2. c7 c5 
151	A01	Nimzo-Larsen Attack: Graz Attack	rnbqkbnr/ppp1pppp/8/3p4/8/BP6/P1PPPPPP/RN1QKBNR b KQkq -	b2b3 d7d5 c1a3	1. b2 b3 2. d7 d5 3. c1 a3 
152	A01	Nimzo-Larsen Attack: Indian Variation	rnbqkb1r/pppppppp/5n2/8/8/1P6/P1PPPPPP/RNBQKBNR w KQkq -	b2b3 g8f6	1. b2 b3 2. g8 f6 
153	A01	Nimzo-Larsen Attack: Modern Variation	r1bqkbnr/pppp1ppp/2n5/4p3/8/1P2P3/PBPP1PPP/RN1QKBNR b KQkq -	b2b3 e7e5 c1b2 b8c6 e2e3	1. b2 b3 2. e7 e5 3. c1 b2 4. b8 c6 5. e2 e3 
154	A01	Nimzo-Larsen Attack: Modern Variation	r1bqkbnr/pppp1ppp/2n5/4p3/8/1P6/PBPPPPPP/RN1QKBNR w KQkq -	b2b3 e7e5 c1b2 b8c6	1. b2 b3 2. e7 e5 3. c1 b2 4. b8 c6 
